{"$schema":"https://json-schema.org/draft/2020-12/schema","$id":"https://vietdub.local/schemas/voice-catalog.schema.json","type":"object","additionalProperties":false,"required":["schema_version","provider_id","approved","sends_data_off_device","terms_url","voices"],"properties":{"schema_version":{"const":1},"provider_id":{"const":"openai-compatible"},"approved":{"const":true},"sends_data_off_device":{"const":true},"terms_url":{"type":"string","format":"uri"},"voices":{"type":"array","minItems":1,"items":{"type":"object","additionalProperties":false,"required":["voice_id","display_name","language"],"properties":{"voice_id":{"type":"string"},"display_name":{"type":"string"},"language":{"type":"string"}}}}}}
